"Status","Start Time","Stop Time","Duration in ms","Parent Suite","Suite","Sub Suite","Test Class","Test Method","Name","Description"
"passed","Tue Mar 11 00:28:42 GMT 2025","Tue Mar 11 00:28:42 GMT 2025","513","Homework Suite","Regression for homework","homework.ApiTest","homework.ApiTest","getUsersAndVerifyAtInFirstEmail_Test_5","getUsersAndVerifyAtInFirstEmail_Test_5","Gets users from an endpoint parses it and verifies that the first user has @ symbol in it's e-mail"
"passed","Tue Mar 11 00:28:44 GMT 2025","Tue Mar 11 00:28:47 GMT 2025","2370","Homework Suite","Regression for homework","homework.SauceDemoTest","homework.SauceDemoTest","verifyLoginErrorAndFooter_Test_2","verifyLoginErrorAndFooter_Test_2","Verifies login error on sauce lab's demo page"
"passed","Tue Mar 11 00:28:44 GMT 2025","Tue Mar 11 00:28:48 GMT 2025","3903","Homework Suite","Regression for homework","homework.RichTextEditorTest","homework.RichTextEditorTest","validateTextInRichTextEditor_Test3","validateTextInRichTextEditor_Test3","Playing with rich text editor"
"passed","Tue Mar 11 00:28:44 GMT 2025","Tue Mar 11 00:28:53 GMT 2025","8590","Homework Suite","Regression for homework","homework.SauceDemoTest","homework.SauceDemoTest","automatePurchaseProcess_Test_1","automatePurchaseProcess_Test_1","Verifies purchase process of the sauce lab's demo page"
"passed","Tue Mar 11 00:28:52 GMT 2025","Tue Mar 11 00:28:55 GMT 2025","2333","Homework Suite","Regression for homework","homework.RetryTest","homework.RetryTest","passesAfterRetriesAndTakesScreenshot","passesAfterRetriesAndTakesScreenshot","This test verifies the retry feature of the framework"
"passed","Tue Mar 11 00:28:47 GMT 2025","Tue Mar 11 00:33:25 GMT 2025","277909","Homework Suite","Regression for homework","homework.DemoGuru99Test","homework.DemoGuru99Test","iframeTabHandlingAlertTest_Test_4","iframeTabHandlingAlertTest_Test_4","Interacts with elements in an iframe, closes a browser tab, raises and handles an alert, and interacts with a dropdown"
