"Status","Start Time","Stop Time","Duration in ms","Parent Suite","Suite","Sub Suite","Test Class","Test Method","Name","Description"
"passed","Tue Mar 11 00:19:40 GMT 2025","Tue Mar 11 00:19:42 GMT 2025","2318","Homework Suite","Regression for homework","homework.RetryTest","homework.RetryTest","passesAfterRetriesAndTakesScreenshot","passesAfterRetriesAndTakesScreenshot","This test verifies the retry feature of the framework"
"passed","Tue Mar 11 00:19:31 GMT 2025","Tue Mar 11 00:24:10 GMT 2025","279354","Homework Suite","Regression for homework","homework.DemoGuru99Test","homework.DemoGuru99Test","iframeTabHandlingAlertTest_Test_4","iframeTabHandlingAlertTest_Test_4","Interacts with elements in an iframe, closes a browser tab, raises and handles an alert, and interacts with a dropdown"
"passed","Tue Mar 11 00:19:28 GMT 2025","Tue Mar 11 00:19:29 GMT 2025","532","Homework Suite","Regression for homework","homework.ApiTest","homework.ApiTest","getUsersAndVerifyAtInFirstEmail_Test_5","getUsersAndVerifyAtInFirstEmail_Test_5","Gets users from an endpoint parses it and verifies that the first user has @ symbol in it's e-mail"
"passed","Tue Mar 11 00:19:31 GMT 2025","Tue Mar 11 00:19:40 GMT 2025","8919","Homework Suite","Regression for homework","homework.SauceDemoTest","homework.SauceDemoTest","automatePurchaseProcess_Test_1","automatePurchaseProcess_Test_1","Verifies purchase process of the sauce lab's demo page"
"passed","Tue Mar 11 00:19:31 GMT 2025","Tue Mar 11 00:19:34 GMT 2025","2760","Homework Suite","Regression for homework","homework.SauceDemoTest","homework.SauceDemoTest","verifyLoginErrorAndFooter_Test_2","verifyLoginErrorAndFooter_Test_2","Verifies login error on sauce lab's demo page"
"passed","Tue Mar 11 00:19:31 GMT 2025","Tue Mar 11 00:19:35 GMT 2025","4588","Homework Suite","Regression for homework","homework.RichTextEditorTest","homework.RichTextEditorTest","validateTextInRichTextEditor_Test3","validateTextInRichTextEditor_Test3","Playing with rich text editor"
